{
  "$schema": "../../../../../schemas/character-studio/image-job.schema.json",
  "schema_version": "starlight.character_image_job.v1",
  "job_id": "2026-08-23-lyra-precision-instrument-v1",
  "agent_id": "lyra-research-conductor",
  "contract_ref": "templates/starlight-character-studio/character-visual-contract.template.json",
  "direction": {
    "territory_id": "precision-instrument",
    "label": "Precision Instrument",
    "hypothesis": "A more architectural relay body makes orchestration legible at thumbnail scale while retaining the porcelain Starlight family",
    "controlled_variables": [
      "same agent identity",
      "same four-to-five crop",
      "same dark neutral background",
      "same porcelain obsidian material family",
      "same calm neutral pose baseline"
    ],
    "changed_variables": [
      "architectural relay collar",
      "stronger shoulder-to-hand signal channels",
      "minimal textile coverage"
    ]
  },
  "use_case": "identity-preserve",
  "asset": {
    "type": "direction-preview",
    "surface": "Starlight Research Team character direction review",
    "aspect_ratio": "4:5",
    "target_width": 1600,
    "target_height": 2000,
    "tier": "B",
    "publication_state": "working"
  },
  "references": [
    {
      "id": "lyra-v1-owned-portrait",
      "path": "assets/starlight-constellation/v1/agents/intelligence-research/lyra-research-conductor.webp",
      "role": "edit-target",
      "rights_status": "owned",
      "lock_level": "preserve-identity"
    }
  ],
  "prompt": {
    "primary_request": "Evolve Lyra into a role-shaped precision relay instrument while preserving her existing identity and Starlight material language",
    "scene": "A restrained black calibration chamber with one architectural rule line and no decorative interface",
    "subject": "Lyra, the same porcelain-and-obsidian research conductor, embodied as a precise multi-channel relay",
    "style_medium": "high-fidelity industrial character design render with museum-object precision",
    "composition": "full-body four-to-five portrait, eye-level, strong readable shoulder and arm silhouette, hands centered around a tangible routing instrument",
    "lighting_mood": "controlled museum lighting, crisp material separation, calm technical confidence, no global glow",
    "color_palette": "aged porcelain, deep obsidian, brushed titanium, narrow cyan signal channels, external warm amber approval marker",
    "materials_textures": "matte porcelain plates, exposed black mechanisms, calibrated metal rails, minimal ink-blue textile joints",
    "constraints": [
      "preserve Lyra's segmented porcelain cranium and narrow black faceplate",
      "preserve human-scale non-human machine proportions",
      "make relay architecture visible in collar shoulders forearms and hands",
      "show many bounded channels resolving into one physical output",
      "keep the human approval marker separate from the body",
      "no generated text or logos"
    ],
    "avoid": [
      "cape or robe silhouette",
      "pedestal statue composition",
      "weapons or combat armor",
      "crown throne or divine core",
      "busy glowing interface",
      "generic sci-fi armor"
    ],
    "final_prompt": "Use case: identity-preserve. Asset type: 4:5 Starlight character direction preview. Image 1 is the owned Lyra edit target and identity reference. Preserve Lyra's segmented ivory porcelain cranium, narrow black faceplate, calm non-human identity, human-scale proportions, obsidian mechanics, and restrained ink-blue accents. Evolve the body into Precision Instrument: an architectural research-conductor relay with a distinct open radial collar, shoulder-to-forearm signal channels, articulated hands, and one tangible routing instrument that visibly accepts several bounded evidence inputs and produces one physical task packet. Use minimal functional textile only at joints; no cape or robe. Full-body eye-level museum-object portrait in a restrained black calibration chamber with crisp material separation and no pedestal. Narrow cyan channels indicate machine activity; a separate amber approval marker belongs to the human boundary outside the body. Matte porcelain, exposed black mechanisms, brushed titanium, precise seams. No text, no logos, no fake UI, no global glow, no weapons, no combat armor, no crown, throne, divine core, superhero stance, or generic sci-fi armor."
  },
  "output": {
    "status": "generated",
    "path": "assets/starlight-constellation/v2-preview/research-team/candidates/lyra-precision-instrument-v1.png",
    "sha256": "d0d67144616473caa1bd911cb87d6e491f4cbcd8ae59e896f069ece2bffe452f",
    "dimensions": {
      "width": 971,
      "height": 1619
    },
    "provider": "OpenAI",
    "model_or_lane": "runtime-best-available",
    "generation_receipt": "imagegen:019ffda3-8717-7e30-8957-4d6a7bd71085/exec-95ebec75-ac0b-4909-9c65-ba125c5f98cb.png; copied without transformation"
  },
  "qa": {
    "inspected": true,
    "score30": 27,
    "decision": "iterate",
    "strongest_element": "The relay collar, cyan channels, and tangible multi-input router produce the clearest first-glance specialty in the set",
    "weakest_element": "The amber chest core violates the visual governance invariant and the wall pictogram reads like an unnecessary interface symbol",
    "next_change": "Preserve the full-body relay form and router while moving amber authority entirely onto a physical environmental control",
    "human_decision": "pending"
  },
  "created_at": "2026-08-23"
}
